,rank,name,headquarter,category,description,link,year
0,1,CUTISS AG,Schlieren,Biotech,Personalized skin,https://www.top100startups.swiss/CUTISS,2020
1,2,Wingtra AG,Zürich,Robotics,"Fly like an airplane, take-off and land like a helicopter",https://www.top100startups.swiss/Wingtra,2020
2,3,Piavita AG,Zürich,Medtech,Daily assistant for equine veterinarians,https://www.top100startups.swiss/Piavita,2020
3,4,Exeon Analytics AG,Zürich,Security,Exeon Analytics detects hidden cyber threats,https://www.top100startups.swiss/Exeon,2020
4,5,Versantis AG,Zürich,Biotech,Conquer liver diseases and saves lives,https://www.top100startups.swiss/Versantis,2020
5,6,9T Labs AG,Zürich,Engineering,3D carbon fiber printing technology,https://www.top100startups.swiss/9T,2020
6,7,Gamaya SA,Morges,Robotics,Digital agronomy solutions for large farming businesses,https://www.top100startups.swiss/Gamaya,2020
7,8,Resistell AG,Muttenz,Medtech,Revolutionary alternative for antibiotic susceptibility testing,https://www.top100startups.swiss/Resistell,2020
8,9,CREAL SA,Ecublens,Engineering,Enabling Augmented Reality within arm's reach,https://www.top100startups.swiss/CREAL,2020
9,10,Insolight SA,Renens,Cleantech,Solar modules designed for agrivoltaics,https://www.top100startups.swiss/Insolight,2020
10,11,Ledgy AG,Zurich,Fintech,Your equity set for growth,https://www.top100startups.swiss/Ledgy,2020
11,12,Carvolution AG,Bannwil,ICT,Car Subscription Model for Switzerland,https://www.top100startups.swiss/Carvolution,2020
12,13,Araris Biotech AG,Au,Biotech,Building tomorrow's antibody-drug conjugates (ADCs),https://www.top100startups.swiss/Araris,2020
13,14,AgroSustain SA,Renens,Foodtech,AgroSustain – a one-stop-shop solution for biological plant,https://www.top100startups.swiss/AgroSustain,2020
14,15,TOLREMO therapeutics AG,Muttenz,Biotech,Development of resistance-breaking cancer therapies,https://www.top100startups.swiss/TOLREMO,2020
15,16,Crypto Finance AG,Zug,Fintech,Transforming financial services,https://www.top100startups.swiss/CryptoFinance,2020
16,17,Eyeware Tech SA,Martigny,ICT,Attention Sensing with 3D Eye Tracking,https://www.top100startups.swiss/Eyeware,2020
17,18,Haelixa AG,Kemptthal,Biotech,Reliable product identification through DNA technology,https://www.top100startups.swiss/Haelixa,2020
18,19,Skribble AG,Zurich,ICT,Digital signature solution,https://www.top100startups.swiss/Skribble,2020
19,20,yamo AG,Zug,Foodtech,Good Food for Kids. Made easy with yamo.,https://www.top100startups.swiss/yamo,2020
20,21,Bring! Labs AG,Zürich,ICT,Bring! simplifies grocery shopping for you,https://www.top100startups.swiss/Bring,2020
21,22,Avrios International AG,Zürich,ICT,We make mobility work for business,https://www.top100startups.swiss/Avrios,2020
22,23,Loanboox GmbH,Zürich,Fintech,European debt capital market platform,https://www.top100startups.swiss/Loanboox,2020
23,24,PriceHubble AG,Zürich,Proptech,Big data and artificial intelligence for real estate markets,https://www.top100startups.swiss/PriceHubble,2020
24,25,MOBBOT SA,Fribourg,Proptech,Mobile 3D concrete printing systems,https://www.top100startups.swiss/MOBBOT,2020
25,26,Annaida Technologies SA,Lausanne,Biotech,Non invasive chemical analysis at embryo scale,https://www.top100startups.swiss/Annaida,2020
26,27,PharmaBiome AG,Zürich,Biotech,Next Generation Microbiome Therapies,https://www.top100startups.swiss/PharmaBiome,2020
27,28,PXL Vision AG ,Zürich,Security,Scalable software platform for secure identity verification,https://www.top100startups.swiss/PXL,2020
28,29,Volumina Medical SA,Epalinges,Medtech,Dynamic biomaterials for reconstructive and plastic surgery,https://www.top100startups.swiss/Volumina,2020
29,30,LuckaBox Logistics AG,Winterthur,ICT,SAAS Last Mile Digital Forwarder for Enterprises,https://www.top100startups.swiss/LuckaBox,2020
30,31,DeepCode AG ,Zurich,ICT,Enabling developers with existing open source software,https://www.top100startups.swiss/DeepCode,2020
31,32,Dotphoton AG,Zug,ICT,Reliable image data for critical applications and AI,https://www.top100startups.swiss/Dotphoton,2020
32,33,neon Switzerland AG,Zürich,Fintech,Mobile Banking solution,https://www.top100startups.swiss/Neon,2020
33,34,aktiia SA,Neuchatel,Medtech,Reinventing Blood Pressure Monitoring,https://www.top100startups.swiss/aktiia,2020
34,35,inyova AG,Zurich,Fintech,We create a more sustainable world through investing,https://www.top100startups.swiss/Inyova,2020
35,36,ONWARD Medical SA,Lausanne,Biotech,Enabling nervous system rewiring,https://www.top100startups.swiss/Onward,2020
36,37,Planted Foods AG,Kemptthal,Foodtech,Planted meats,https://www.top100startups.swiss/Planted,2020
37,38,Sevensense Robotics AG,Zürich,Robotics,Visual navigation for the next generation of service robots.,https://www.top100startups.swiss/Sevensense,2020
38,39,Yokoy Group AG,Zurich,Fintech,Your expenses and company credit cards on autopilot,https://www.top100startups.swiss/yokoy,2020
39,40,INVOLI SA,Renens,ICT,Enabling the safe integration of drones into the airspace,https://www.top100startups.swiss/INVOLI,2020
40,41,ANYbotics AG,Zürich,Robotics,Autonomous robots for industrial inspection,https://www.top100startups.swiss/ANYbotics,2020
41,42,Nomoko AG,Zurich,ICT,Creating a digital twin of the world,https://www.top100startups.swiss/Nomoko,2020
42,43,HAYA Therapeutics SA,Epalinges,Biotech,Treating heart failure through innovative RNA-therapies,https://www.top100startups.swiss/HAYA,2020
43,44,Oculis SA,Lausanne,Biotech,Next Generation of Topical Ophthalmic Treatments,https://www.top100startups.swiss/Oculis,2020
44,45,Apiax AG,Zürich,Fintech,Removing barriers with embedded compliance,https://www.top100startups.swiss/Apiax,2020
45,46,Futurae Technologies AG,Zurich,Security,Secure Authentication for users has never been easier,https://www.top100startups.swiss/Futurae,2020
46,47,Microcaps AG,Zurich-Schlieren,Engineering,Microencapsulation at Swiss Precision,https://www.top100startups.swissindex.cfm?CFID=72313628&CFTOKEN=b25424f255d2862f-57043D28-C7D9-9B77-739FB33ACE36FC5F&page=136348&profil_id=18261,2020
47,48,Neural Concept SA,Lausanne,ICT,Optimizing engineering processes,https://www.top100startups.swiss/Neural,2020
48,49,Versameb AG ,Basel,Biotech,The next generation of RNA therapeutics,https://www.top100startups.swiss/Versameb,2020
49,50,Olympe SA,Lausanne,ICT,The best composition platform in the market,https://www.top100startups.swiss/Olympe,2020
50,51,GUURU Solutions AG,Zürich,ICT,Customer Service. Automated and with human touch,https://www.top100startups.swiss/guuru,2020
51,52,T3 Pharmaceuticals AG,Allschwil,Biotech,Developing the next generation bacterial cancer therapy,https://www.top100startups.swiss/T3,2020
52,53,Topadur Pharma AG,Schlieren,Biotech,Disruptive drugs for aging diseases,https://www.top100startups.swiss/Topadur,2020
53,54,Nexxiot AG,Zürich,Engineering,enabler of the digitized supply chain,https://www.top100startups.swiss/Nexxiot,2020
54,55,Voliro AG,Zürich,Robotics,Aerial robots for in-depth inspection and maintenance,https://www.top100startups.swiss/Voliro,2020
55,56,Flybotix SA,Renens,Robotics,Doubling flight time of prof. indoor inspection drones,https://www.top100startups.swiss/Flybotix,2020
56,57,Dufour Aerospace AG,Visp,Robotics,Advanced electric aircraft,https://www.top100startups.swiss/DufourAerospace,2020
57,58,Archilyse AG,Zürich,Proptech,Archilyse.one makes your plans smart,https://www.top100startups.swiss/Archilyse,2020
58,59,MaxWell Biosystems AG,Zurich,Biotech,High-Content electrophysiology platforms,https://www.top100startups.swiss/MaxWell,2020
59,60,Perseo pharma AG,Muttenz,Biotech,Metabolic Therapies,https://www.top100startups.swiss/Perseo,2020
60,61,EraCal Therapeutics AG,Schlieren,Biotech,We develop the next generation anti-obesity drug,https://www.top100startups.swiss/EraCal,2020
61,62,CYSEC SA,Lausanne,Security,Confidential Computing solution for data in use protection,https://www.top100startups.swiss/CYSEC,2020
62,63,Synple Chem AG,Zurich,Biotech,Making synthesis of new molecules as easy as capsule coffee,https://www.top100startups.swiss/Synple,2020
63,64,legartis technology AG,Zürich,ICT,Analyse your contracts in seconds,https://www.top100startups.swiss/Legartis,2020
64,65,AVAtronics SA,Lausanne,Engineering,Wideband Active Noise Cancellation (Hearables & Automotive),https://www.top100startups.swiss/AVAtronics,2020
65,66,Gmelius SA,Cointrin,ICT,Gmelius transforms Gmail into your company's workspace,https://www.top100startups.swiss/Gmelius,2020
66,67,Procsea SA,Lausanne,Foodtech,"A faster, easier and cheaper solution to trade seafood",https://www.top100startups.swiss/Procsea,2020
67,68,xorlab AG,Zürich,Security,Redefining enterprise communication security,https://www.top100startups.swiss/xorlab,2020
68,69,INPHER Sàrl,Lausanne,Security,Cryptographic Secret Computing® technology,https://www.top100startups.swiss/INPHER,2020
69,70,LARGO FILMS SA,Lausanne,ICT,Next generation storytelling,https://www.top100startups.swiss/Largo,2020
70,71,Scailyte AG,Basel,Biotech,Extracting knowledge from single-cell data to save lives,https://www.top100startups.swiss/Scailyte,2020
71,72,Altoida AG,Luzern,Medtech,Join us on our noble mission to better brain health,https://www.top100startups.swiss/Altoida,2020
72,73,Elthera AG,Schlieren,Biotech,Tailored cancer therapies,https://www.top100startups.swiss/Elthera,2020
73,74,Artiria Medical SA,Borex,Medtech,"We fight stroke, we save lives",https://www.top100startups.swiss/Artiria,2020
74,75,Miraex SA,Ecublens,Engineering,Photonic sensing and quantum solutions,https://www.top100startups.swiss/Miraex,2020
75,76,Auterion AG,Zürich,Robotics,Open source infrastructure for autonomous robots,https://www.top100startups.swiss/Auterion,2020
76,77,Instimatch Global AG,Zürich,Fintech,Global P2P Money Market Network,https://www.top100startups.swiss/InstimatchGlobal,2020
77,78,BitsaboutMe AG,Bern,ICT,Marketplace for saving and trading personal data,https://www.top100startups.swiss/BitsaboutMe,2020
78,79,Pregnolia AG,Schlieren,Medtech,Predicting the risk of premature birth,https://www.top100startups.swiss/Pregnolia,2020
79,80,RAW Labs SA,Lausanne,ICT,Empowering enterprises to use their resources wisely,https://www.top100startups.swiss/RAW,2020
80,81,IDUN Technologies AG,Opfikon,Medtech,Enabling the Internet of Humans,https://www.top100startups.swiss/IDUN,2020
81,82,Fixposition AG,Schlieren,Robotics,Precise Positioning Everywhere.,https://www.top100startups.swiss/Fixposition,2020
82,83,SwissDeCode SA,Lausanne,Foodtech,Secure and Build Trust in the Global Food Supply Chain,https://www.top100startups.swiss/SwissDeCode,2020
83,84,TestingTime AG,Zürich,ICT,We recruit test users for user and market research,https://www.top100startups.swiss/TestingTime,2020
84,85,Nagi Bioscience SA,Ecublens,Biotech,“Organism-on-Chip” technology for drug/chemical screening,https://www.top100startups.swiss/Nagi,2020
85,86,Sygnum Bank AG,Zurich,Fintech,Digital asset specialist with global reach,https://www.top100startups.swiss/Sygnum,2020
86,87,Taurus SA,Geneva,Fintech,Swiss digital asset custody solution,https://www.top100startups.swiss/Taurus,2020
87,88,Daphne Technology SA,St-Sulpice VD,Cleantech,Climate tech comp reducing toxic pollutants & GHG emissions,https://www.top100startups.swiss/Daphne,2020
88,89,Anaveon AG,Basel,Biotech,Immunotherapies for cancer,https://www.top100startups.swiss/Anaveon,2020
89,90,hemotune AG,Schlieren,Medtech,Magnetic Blood Purification,https://www.top100startups.swiss/hemotune,2020
90,91,Imverse SA,Morges,ICT,3D Holograms: real-time volumetric video for telepresence,https://www.top100startups.swiss/Imverse,2020
91,92,GRZ Technologies AG,Grolley,Cleantech,Metal hydride hydrogen storage solution,https://www.top100startups.swiss/GRZ,2020
92,93,holo one AG,Lenzburg,ICT,The Augmented Reality Standard for Enterprises,https://www.top100startups.swiss/holo,2020
93,94,Seervision AG,Zurich,Engineering,We make any camera autonomous,https://www.top100startups.swiss/Seervision,2020
94,95,SONECT AG,Zürich,Fintech,"Through Sonect, every store becomes an ATM",https://www.top100startups.swiss/SONECT,2020
95,96,ASPIVIX SA,Renens,Medtech,Modern Gynecological Products for Women's Health,https://www.top100startups.swiss/ASPIVIX,2020
96,97,MyCamper AG,Basel,ICT,Sharing platform for campers,https://www.top100startups.swiss/myCamper,2020
97,98,DePoly SA,Sion,Cleantech,Closing the loop on PET plastic recycling,https://www.top100startups.swiss/DePoly,2020
98,99,advaisor AG,Zürich,ICT,We make corporate culture measurable,https://www.top100startups.swiss/advAIsor,2020
99,100,Anapaya Systems AG,Zurich,Security,Securing and Optimizing Internet Communication,https://www.top100startups.swiss/Anapaya,2020
